,name,sex,lifespan,age,hometown,university,faculty,famous for,museum,started,worked until,years of working,humanitarian education
63,Светлана Николаевна Ше́тракова,f,1951-н.в.,72,Москва,Московский государственный университет им. М. В. Ломоносова,Филологический,директор музея,Московский музей С.А. Есенина,,,,True
64,Алекса́ндр Я́ковлевич Шко́льник,m,1964-н.в.,58,Нижний Тагил,"Уральский государственный университет, Российская академия народного хозяйства и государственной службы при Президенте РФ","Журналистика, Педагогический",журналист,Музей победы,2017.0,2023.0,6.0,False
65,Ви́ктор Алекса́ндрович Шмы́ров,m,1946-н.в.,76,"Чусовой, Пермская область",Пермский государственный университет,Исторический,"педагог, краевед, историк",Мемориальный центр истории политических репрессий «Пермь-36»,,,,True
66,Яросла́в Никола́евич Ща́пов,m,1928-2011,82,Москва,Московский государственный университет им. М. В. Ломоносова,Исторический,историк,Муниципальный музей истории усадьбы Щапово,1998.0,2008.0,10.0,True
67,Лев Андре́евич Ястрже́мбский,m,1921-2000,79,Москва,Московский областной педагогический институт,Исторический,"историк, директор музея",Музей истории и реконструкции г. Москвы,1953.0,1976.0,23.0,True
